category,subcategory,name,description,url,price,image
Fashion,Women's Clothing,Contrast Crochet Cardigan,"Introducing the Contrast Crochet Cardigan in Cream and Gold, a stunning piece that effortlessly blends comfort with a touch of glamour. Crafted with meticulous attention to detail, this cardigan is a versatile addition to any wardrobe, offering both warmth and style in one elegant package.
The outer shell of this cardigan is an intricate blend of 35% acrylic, 30% cotton, 22% polyester, and 13% metallised fiber. adding a subtle shimmer that catches the light beautifully. The acrylic provides durability and resilience, while the cotton offers a gentle, natural feel against the skin. The polyester adds strength and elasticity, and the metallised fiber introduces a hint of sparkle, making this cardigan perfect for both casual and dressier occasions.
In a chic cream and gold palette, this cardigan features a delicate crochet pattern that adds a layer of sophistication to any outfit. Its versatile design makes it suitable as a blouse, top, or sweater, providing numerous styling options. Wear it over a simple dress for a touch of elegance or pair it with jeans for a casual yet polished look. The cardigan's relaxed fit and open front design ensure comfort and ease of wear, while the gold accents enhance its luxurious appeal.
To maintain the beauty and longevity, we recommend hand washing at a maximum temperature of 30ºC/86ºF. Iron at a low temperature of up to 110ºC/230ºF if needed, but refrain from dry cleaning or tumble drying to prevent damage.
Keywords: blouse, top, tops, sweater, cardigan",https://www.zara.com/us/en/-p01957025.html?v1=375799338&v2=2352849,69.9,https://static.zara.net/assets/public/03c6/7460/85174ec2a07d/b2cecc86da7f/01957025303-a2/01957025303-a2.jpg?ts=1717168652460&w=1500
Fashion,Women's Clothing,Black Polka-Dotted Slip Dress,"Discover timeless elegance with our Black Polka-Dotted Slip Dress. This chic and playful dress is designed to make a statement, combining classic patterns with a modern silhouette for a look that’s both sophisticated and fun.
Featuring a delicate V-neck and spaghetti straps, this dress highlights your shoulders and collarbone, adding a touch of femininity and allure. The A-line silhouette flatters all body types, gracefully skimming over the hips and creating a balanced, elegant look. The playful polka dots add a fun twist to the classic black dress, making it perfect for a variety of occasions, from casual outings to evening events.
Crafted from 100% viscose, this dress offers a silky, smooth texture that feels luxurious against the skin. The fabric drapes beautifully, enhancing the dress's flowy A-line shape and ensuring a comfortable fit throughout the day.
The Black Polka-Dotted Slip Dress is incredibly versatile, easily transitioning from day to night. Pair it with sandals and a sun hat for a chic daytime look, or dress it up with heels and statement jewelry for a sophisticated evening ensemble. Its timeless design ensures it will remain a staple in your wardrobe for years to come.
Machine wash on a delicate cycle at a maximum temperature of 30ºC/86ºF. Iron at a low temperature of up to 110ºC/230ºF if needed, and for professional cleaning, use tetrachloroethylene. Do not tumble dry to maintain the fabric's quality and shape.
",https://www.zara.com/us/en/dotted-slip-dress-zw-collection-p08148125.html?v1=375812111&v2=2352540,59.9,https://static.zara.net/assets/public/b542/6fb8/1e6949778494/5ceecc75e616/08148125800-p/08148125800-p.jpg?ts=1716985926642&w=1500
Fashion,Women's Clothing,Lace Camisole in Black,"Elevate your wardrobe with the elegant Lace Camisole in Black. This sophisticated camisole top combines intricate lace detailing with a classic silhouette. Pair with a blazer and trousers for a chic office look, or wear it with a skirt and heels for an effortlessly stylish evening outfit. 
This black V-neck camisole features adjustable tied spaghetti straps, allowing you to customize the fit for maximum comfort. The tonal textured floral lace detail adds a touch of romantic elegance, making it perfect for both day and night. The delicate lace design enhances the neckline and adds a feminine flair to this timeless piece. The camisole’s sleek silhouette makes it an ideal choice for layering or wearing on its own.
Outer shell and lining are 100% polyester, the secondary fabric, composed of 100% polyamide, contributes to the camisole’s lightweight and breathable nature.
Available in black and in white, this lace camisole offers versatility in styling. The black option exudes sophistication and can easily be paired with anything from denim to formal skirts. The white version offers a fresh, airy look that’s perfect for warmer days or for adding a light touch to outfits.
To maintain the beauty and integrity of your Lace Camisole, machine wash it on a gentle cycle at a maximum temperature of 30ºC/86ºF. Iron at a low temperature of up to 110ºC/230ºF if needed, and avoid dry cleaning and tumble drying to extend the life of your garment.
Keywords: blouse, top, tops, camisole, camisoles",https://www.zara.com/us/en/lace-camisole-p07521081.html?v1=350366168&v2=2353253,39.9,https://static.zara.net/assets/public/b5ca/0da4/340343e1b40f/3c13b7bcef63/07521081800-p/07521081800-p.jpg?ts=1715345586333&w=1500
Fashion,Women's Clothing,Lace Camisole in White,"Enhance your wardrobe with the elegant Lace Camisole in White, a versatile piece that seamlessly blends classic charm with modern sophistication. This stunning camisole top is designed to elevate any outfit, making it a must-have addition to your collection. Pair with skirt and heels for an effortlessly stylish evening outfit. Adjustable straps and comfortable fit make it suitable for various body types.
The white V-neck camisole features adjustable tied spaghetti straps, allowing you to customize the fit for ultimate comfort. The tonal textured floral lace detail adds a touch of delicate elegance, enhancing the neckline and creating a romantic, feminine look. 
The outer shell and lining are made from 100% polyester, ensuring a smooth and durable finish. The secondary fabric, composed of 100% polyamide, adds a lightweight and breathable element, enhancing comfort.
In addition to the pristine white, the Lace Camisole is also available in classic black. Both color options offer versatility and timeless appeal. The white version provides a fresh, airy look that’s perfect for warmer days or adding a light, elegant touch to your outfits. The black option exudes sophistication and pairs effortlessly with a variety of ensembles.
Machine wash it on a gentle cycle at a maximum temperature of 30ºC/86ºF. Iron at a low temperature of up to 110ºC/230ºF if needed, and avoid dry cleaning and tumble drying to extend the life of your garment.
Keywords: blouse, top, tops, camisole, camisoles",https://www.zara.com/us/en/lace-camisole-p07521081.html?v1=350366168&v2=2353253,39.9,https://static.zara.net/assets/public/7982/05cd/bc4a47faadda/95a1f1be36e9/07521081250-a1/07521081250-a1.jpg?ts=1715345593230&w=1500
Fashion,Women's Clothing,Open Knit Romantic Top,"Embrace the delicate charm of the Open Knit Romantic Top, with a round neck and short sleeves. The front closure with tonal lined buttons adds a touch of sophistication. The intricate open knit pattern showcases a blend of textures that creates a romantic and feminine look. Perfect for layering or wearing on its own, this top transitions seamlessly from day to night.
Crafted with care, the outer shell of this top consists of 67% polyester, 30% cotton, and 3% other fibres, ensuring durability and comfort. The lace details, made from 66% cotton and 34% polyester, add a delicate touch that enhances the overall design. Additionally, this top includes at least 30% RCS-certified recycled cotton and 67% RCS-certified recycled polyester, making it an eco-friendly choice that supports sustainable fashion.
Pair it with a skirt and heels for an elegant evening look, or with jeans and flats for a casual yet chic daytime outfit. Its classic design and neutral tones make it easy to mix and match with various pieces, ensuring endless styling possibilities.
Machine wash it on a gentle cycle at a maximum temperature of 30ºC/86ºF. Iron at a low temperature of up to 110ºC/230ºF if needed, and refrain from dry cleaning and tumble drying to extend the life of your garment.
Keywords: blouse, top, tops, sweater, cardigan",https://www.zara.com/us/en/open-knit-romantic-top-p06236002.html?v1=360012440&v2=2352849,45.9,https://static.zara.net/assets/public/e3ce/f8c7/0a4047a394bd/3da9168e090b/06236002712-a2/06236002712-a2.jpg?ts=1717081844090&w=1500
Fashion,Women's Clothing,Pearl Button Basic Knit Cardigan,"Button Basic Knit Cardigan is a timeless piece that blends classic elegance with modern comfort and designed to be a versatile addition to your wardrobe, perfect for any season and a variety of occasions.
This cardigan features a sophisticated round neck and below-the-elbow length sleeves. The front pearl button closure adds a touch of luxury and elegance, making it a standout piece that exudes understated sophistication that can be dressed up or down effortlessly.
Crafted from a high-quality blend of 82% viscose, 16% polyamide, and 2% elastane, this cardigan offers a soft, comfortable feel and a flattering fit.
The Pearl Button Basic Knit Cardigan in white is a versatile piece that can be paired with a variety of outfits. Wear it over a blouse and tailored trousers for a polished office look, or layer it over a camisole and jeans for a chic, casual ensemble. Its neutral color and classic design make it easy to mix and match with other wardrobe staples, ensuring endless styling possibilities.
Machine wash it on a gentle cycle at a maximum temperature of 30ºC/86ºF. Iron at a low temperature of up to 110ºC/230ºF if needed, and avoid dry cleaning and tumble drying to extend the life of your garment.
Keywords: blouse, top, tops, sweater, cardigan",https://www.zara.com/us/en/pearl-button-basic-knit-cardigan-p00506112.html?v1=324196502&v2=2352849,45.9,https://static.zara.net/assets/public/0752/060d/d93b4a038fe1/fba1ad4ed71d/00506112250-a1/00506112250-a1.jpg?ts=1712767257818&w=1500
Fashion,Women's Clothing,Satin Effect Midi Skirt in Black,"Satin Effect Midi Skirt in Black is high-rise midi skirt is designed to flatter and enhance your silhouette, making it a versatile addition to your collection.
Featuring a high-rise fit and an elastic waistband, this midi skirt ensures both comfort and style. The elastic waistband allows for easy movement throughout the day. The black satin effect adds a touch of luxurious shine, making this skirt perfect for both casual and formal occasions. Its midi length offers a timeless, elegant look that can be dressed up or down.
Crafted from 100% RCS-certified recycled polyester, the use of recycled materials demonstrates a commitment to sustainability without compromising on quality or style. 
In addition to classic black, this skirt is also available in pristine white, offering versatility in styling. The black option exudes elegance and pairs easily with various tops and accessories, while the white version provides a fresh, airy look that’s perfect for warmer days or adding a light touch to your outfit.
The Satin Effect Midi Skirt in Black is a must-have for any wardrobe. Pair it with a camisole and heels for a chic office look, or with a casual top and flats for a relaxed yet polished ensemble. Its timeless design and luxurious fabric make it suitable for a wide range of occasions, from work to weekend outings.
Machine wash on a delicate cycle at a max temp of 30ºC/86ºF. Iron at a low temp of up to 110ºC/230ºF. If needed dry cleaning, use tetrachloroethylene. Do not tumble dry.",https://www.zara.com/us/en/satin-effect-midi-skirt-p08534626.html?v1=372122094&v2=2353253,45.9,https://static.zara.net/assets/public/6632/2528/acb34c7cacc1/a5f474e8b38a/08534626800-018-p/08534626800-018-p.jpg?ts=1715874827631&w=1500
Fashion,Women's Clothing,Satin Effect Midi Skirt in White,"Introducing the Satin Effect Midi Skirt in White, a luxurious and versatile piece that blends timeless elegance with sustainable fashion that can be dressed up or down with ease. Designed to elevate any outfit, this high-rise midi skirt features an elastic waistband for a comfortable and flattering fit. 
Pair it with a blouse and heels for a sophisticated office look, or wear it with a casual top and flats for a relaxed yet chic outfit. Its neutral color and elegant design make it a staple piece that complements any wardrobe.
This midi skirt has a high-rise fit that accentuates your waist and an elastic waistband that ensures ease of movement. The satin effect in white creates a smooth, lustrous finish that adds a touch of sophistication to your look. The midi length provides a timeless silhouette.
Made from 100% RCS-certified recycled polyester, this skirt not only looks beautiful but also supports eco-friendly practices. 
In addition to soft white, this skirt is available in classic black, offering versatility for your wardrobe. The white option delivers a fresh, clean look that pairs well with a variety of tops and accessories, perfect for creating light and airy ensembles. The black version provides a timeless elegance that’s easy to style for any occasion.
Machine wash on a delicate cycle at a max temp of 30ºC/86ºF. Iron at a low temp of up to 110ºC/230ºF. Opt for tetrachloroethylene for dry cleaning. Refrain from tumble drying to maintain the fabric’s quality and shape.",https://www.zara.com/us/en/satin-effect-midi-skirt-p08534626.html?v1=372122094&v2=2353253,45.9,https://static.zara.net/assets/public/7555/8f27/d2464bccac85/1a6c05baac86/08534626712-018-a1/08534626712-018-a1.jpg?ts=1715617635102&w=1500